CS402,Introduction to Logic for Computer Science,Shin Yoo,53
CS442,Mobile Computing and Applications,Sung-Ju Lee,10
CS448,Introduction to Information Security,Jooyoung Lee,53
CS453,Automated Software Testing,Shin Yoo,26
CS457,Requirements Engineering for Smart Environments,In-Young Ko,9
CS492,Special Topics in Computer Science< Special Topics in Computer Science - Probabilistic Programming>,HONGSEOK YANG,24
CS492,Special Topics in Computer Science<Android Internals>,Steven Y. Ko,14
CS492,Special Topics in Computer Science<Deep Learning>,Sung Ju Hwang,104
CS492,Special Topics in Computer Science< Operation of Information Protection Systems>,Heung Taek Kim,4
CS492,Special Topics in Computer Science<Another Computer Science 3: author's perspective >,Junehwa Song,6
CS500,Design and Analysis of Algorithm,Martin ZIEGLER,75
CS510,Computer Architecture,Jaehyuk Huh,33
CS522,Theory of Formal Language and Automata,Kwang-Moo Choe,23
CS543,Distributed Systems,Dongman Lee,22
CS546,Wireless Mobile Internet,Myungchul Kim,7
CS550,Software Engineering,Jongmoon Baik,5
CS564,Big Data Analytics Using R,Meeyoung Cha,33
CS570,Artificial Intelligence and Machine Learning,Choi HoJin,37
CS574,Natural Language Processing I,Key-Sun Choi,44
CS580,Computer Graphics,Park Jinah,32
CS592,Special Topics in Computing<Advanced machine learning: High-dimensional data analysis >,Eunho Yang,23